排序,國別地區,中文片名,上映日期,申請人,出品,上映院數,銷售票數,票數變動率,銷售金額,累計銷售票數,累計銷售金額
1,中華民國,人面魚紅衣小女孩外傳,2018/11/23,威視股份有限公司,中環國際娛樂事業股份有限公司##講故事有限公司##大慕影藝國際事業有限公司##華映娛樂股份有限公司##秀泰國際娛樂有限公司##國賓影城股份有限公司##樂到家國際娛樂股份有限公司##華研國際音樂股份有限公司##紅衣小女孩股份有限公司,93,"131,809",17.76%,"29,320,350","243,737","54,210,294"
2,挪威,芮氏9.6,2018/11/23,車庫娛樂股份有限公司,(丹麥) TRUSTNORDISK APS,46,"21,931",-8.29%,"4,872,746","45,845","10,257,628"
3,日本,電影版七大罪天空的囚人,2018/11/23,車庫娛樂股份有限公司,(香港)MEDIALINK ENTERTAINMENT LIMITED,10,"2,639",-15.36%,"631,683","5,757","1,392,163"
4,美國,壞事大飯店,2018/11/23,美商廿世紀福斯影片股份有限公司台灣分公司,TWENTIETH CENTURY FOX INTERNATIONAL CORPORATION.,8,"1,820",8.59%,"409,838","3,496","797,932"
5,德國,賣場華爾滋,2018/11/23,前景娛樂有限公司,BETA CINEMA GMBH,11,"1,098",56.86%,"230,892","1,851","389,393"
6,日本,龐克武士,2018/11/23,天馬行空數位有限公司,AVEX PICTURES INC.,11,444,-17.32%,"94,245",981,"209,668"
7,美國,時間之旅,2018/11/23,車庫娛樂股份有限公司,(法國)WILD BUNCH,4,179,34.59%,"39,955",312,"67,525"
8,香港,非同凡響,2018/11/23,香港商甲上娛樂有限公司台灣分公司,AR CHARITABLE FOUNDATION LIMITED##THE HONG KONG COUNCIL OF SOCIAL SERVICE##GOLDEN SCENE COMPANY LIMITED,7,95,28.38%,"20,250",169,"36,365"
9,中華民國,比悲傷更悲傷的故事,2018/11/18,好好看文創有限公司,滿滿額娛樂股份有限公司##好好看文創有限公司##百聿數碼創意股份有限公司##神州音樂有限公司##崴森管理顧問股份有限公司##(大陸)上海唯喜影業有限公司##(香港)福斯傳媒有限公司,88,"139,626",0.00%,"32,088,616","139,750","32,114,656"
10,中華民國,有五個姊姊的我就註定要單身了啊！,2018/11/16,華聯國際影音股份有限公司,(大陸)珠海漢都影視投資有限公司##(大陸)北京嘉映文化傳媒有限公司##(大陸)北京萌樣影視製作有限公司##(大陸)喀什嘉映文化傳媒有限公司##(中華民國)群星瑞智國際娛樂股份有限公司##(中華民國)華聯國際影音股份有限公司##(中華民國)中國信託創業投資股份有限公司##(香港)安樂影片有限公司##(新加坡)MM2 ENTERTAINMENT PTE LTD,58,"1,598",-79.52%,"349,290","19,200","4,237,653"
11,法國,師聲對決,2018/11/16,鴻聯國際開發股份有限公司,PATHE FILMS,10,"1,061",-41.74%,"227,585","4,279","935,371"
12,英國,艾瑞克克萊普頓：藍調天堂路,2018/11/16,翻面映畫有限公司,ALTITUDE FILM SALES LIMITED,5,432,-68.24%,"98,180","2,324","538,630"
13,香港,翠絲,2018/11/16,台北双喜電影發行股份有限公司,天下一電影製作有限公司##品今天下影視有限公司##太陽娛樂文化有限公司##大名娛樂有限公司##框格音樂事務有限公司,15,389,-70.08%,"88,440","2,916","647,321"
14,日本,姐姐的私廚,2018/11/16,英屬蓋曼群島商威望國際娛樂股份有限公司台灣分公司,"TOEI COMPANY,LTD.",10,338,-58.12%,"72,100","2,173","474,921"
15,泰國,交友網戰,2018/11/16,采昌國際多媒體股份有限公司,MONO FILM COMPANY LIMITED,23,306,-80.17%,"69,490","3,575","793,158"
16,比利時,劫局,2018/11/16,原創娛樂股份有限公司,BE FOR FILMS,7,275,-66.55%,"59,625","1,908","409,886"
17,法國,大醫新鮮人,2018/11/16,捷傑有限公司,LE PACTE,5,172,-68.78%,"36,970","1,890","396,985"
18,法國,我想要你記得＿,2018/11/16,光譜映像有限公司,(中華民國)光譜映像HOUSE ON FIRE##(中華民國)財團法人高雄市文化基金會##(法國)CINEMA DEFACTO,9,154,-70.89%,"33,415","1,954","435,023"
19,日本,老師君主,2018/11/16,車庫娛樂股份有限公司,"TOHO CO., LTD.",6,46,-91.99%,"10,060","1,313","294,065"
20,美國,怪獸與葛林戴華德的罪行,2018/11/15,美商華納兄弟(遠東)股份有限公司台灣分公司,WARNER BROS. PICTURES INTERNATIONAL.,97,"163,938",-49.78%,"39,567,807","954,921","231,171,279"
21,南韓,BURN THE STAGE：THE MOVIE,2018/11/15,威秀影城股份有限公司,(英國)TRAFALGAR RELEASING LIMITED,3,88,-95.38%,"35,200","24,770","9,882,400"
22,美國,大君主行動,2018/11/09,美商美國派拉蒙影片股份有限公司台灣分公司,PARAMOUNT PICTURES CORPORATION,80,"12,601",-57.16%,"2,913,817","155,830","36,432,193"
23,美國,鬼靈精,2018/11/09,美商美國環球影片股份有限公司台灣分公司,UNIVERSAL INTERNATIONAL FILMS LLC,69,"2,714",-79.41%,"610,924","72,518","16,412,613"
24,美國,蜘蛛網中的女孩,2018/11/09,博偉電影股份有限公司,SONY PICTURES RELEASING INTERNATIONAL CORPORATION.,41,"1,451",-77.58%,"329,290","53,411","11,946,537"
25,美國,草間∞彌生,2018/11/09,佳映娛樂國際股份有限公司,(英國)DOGWOOF LTD,7,162,-71.02%,"36,085","3,199","699,766"
26,南韓,七罪追緝令,2018/11/09,車庫娛樂股份有限公司,SHOWBOX CORP.,6,127,-75.81%,"29,410","5,197","1,167,835"
27,日本,K SEVEN STORIES EPISODE 5「紅之記憶～BURN～」,2018/11/09,曼迪傳播有限公司,"KING RECORD CO., LTD.",2,16,-81.18%,"3,775","1,125","260,857"
28,芬蘭,無名戰士,2018/11/09,車庫娛樂股份有限公司,(德國)BETA CINEMA GMBH,2,13,-76.36%,"2,840",871,"202,279"
29,西班牙,鬥牛犬：米其林帝國,2018/11/09,海鵬影業有限公司,"(法國)WIDE HOUSE, SARL",1,8,-95.65%,"2,000","1,383","301,630"
30,中華民國,誰先愛上他的,2018/11/02,親愛的工作室有限公司,海納百川娛樂有限公司##原點概念有限公司##親愛的工作室有限公司,88,"33,614",-45.94%,"7,795,982","266,780","61,430,965"
31,美國,波希米亞狂想曲,2018/11/02,美商廿世紀福斯影片股份有限公司台灣分公司,TWENTIETH CENTURY FOX INTERNATIONAL CORPORATION.,59,"9,389",-41.56%,"2,257,932","130,998","31,291,137"
32,印度,我的嗝嗝老師,2018/11/02,捷傑有限公司,YASH RAJ FILMS,11,"1,216",-1.30%,"272,350","15,910","3,541,403"
33,美國,生命中的美好意外,2018/11/02,傳影互動股份有限公司,(匈牙利)GEM ENTERTAINMENT KFT,5,213,-68.16%,"47,980","15,334","3,590,965"
34,中華民國,同學會來嗎,2018/11/02,創意門文創電影事業有限公司,吳仲立##吳建國,1,81,50.00%,"17,830","1,319","291,815"
35,日本,聖☆哥傳,2018/11/02,香港商甲上娛樂有限公司台灣分公司,"SDP,INC.",4,59,-81.45%,"14,603","12,436","3,061,304"
36,美國,嚇地獄,2018/11/02,英屬蓋曼群島商威望國際娛樂股份有限公司台灣分公司,CBS FILMS INC.,3,60,-82.25%,"12,770","13,800","3,055,403"
37,南韓,親密陌生人,2018/11/02,采昌國際多媒體股份有限公司,(匈牙利)FREEWAY ENTERTAINMENT KFT.,4,44,-87.78%,"10,380","8,973","2,051,151"
38,日本,那些年，我們一起追的女孩(日),2018/11/02,天馬行空數位有限公司,"KINO FILMS CO., LTD.",4,33,-76.43%,"7,730","5,860","1,390,625"
39,印度,護墊俠,2018/11/02,車庫娛樂股份有限公司,SPE FILMS INDIA PVT. LTD.,1,7,-75.00%,"1,760","4,904","1,076,355"
40,日本,電影版怪物彈珠空之彼方,2018/11/02,車庫娛樂股份有限公司,(香港)MEDIALINK ENTERTAINMENT LIMITED,1,7,-92.39%,"1,560","8,094","1,910,893"
41,美國,夜驚,2018/11/02,牽猴子整合行銷股份有限公司,BATRAX ENTERTAINMENT B.V.,1,7,-70.83%,"1,330","5,231","1,197,642"
42,英國,馬修．伯恩版仙履奇緣,2018/10/27,威秀影城股份有限公司,MORE2SCREEN LIMITED,1,30,0.00%,"18,960",119,"77,920"
43,美國,潛艦獵殺令,2018/10/26,英屬維京群島商高捷全球開發有限公司 台灣分公司,NU IMAGE INCORPORATED,51,"12,474",-47.49%,"2,909,917","319,154","73,746,552"
44,中華民國,疾風魅影-黑貓中隊,2018/10/26,寬和影像事業有限公司,寬和影像事業有限公司,4,454,-59.82%,"89,070","15,640","3,389,048"
45,美國,登月先鋒,2018/10/26,美商美國環球影片股份有限公司台灣分公司,UNIVERSAL INTERNATIONAL FILMS LLC,3,72,-77.22%,"16,780","63,158","15,373,849"
46,南韓,屍落之城,2018/10/26,車庫娛樂股份有限公司,CONTENTS PANDA,5,39,-87.25%,"9,270","55,076","12,116,514"
47,中華民國,狂徒,2018/10/26,貴金影業傳媒股份有限公司,貴金影業傳媒股份有限公司##高雄市電影館##喜陽影片製作有限公司,1,24,-71.43%,"6,120","25,263","5,642,418"
48,中華民國,幸福城市,2018/10/26,幸福城市股份有限公司,幸福城市股份有限公司##長龢有限公司##財團法人高雄市文化基金會##滿滿額娛樂有限公司##(大陸)青島翰洺影業有限公司,1,20,-91.15%,"5,040","6,510","1,448,377"
49,英國,深夜小狗神祕習題(英國國家劇院現場),2018/10/19,威秀影城股份有限公司,THE ROYAL NATIONAL THEATRE,5,399,392.59%,"271,720",999,"675,520"
50,英國,劊子手(英國國家劇院現場),2018/10/19,威秀影城股份有限公司,THE ROYAL NATIONAL THEATRE,2,192,236.84%,"125,560",544,"352,960"
51,中華民國,紅盒子,2018/10/19,後場音像紀錄工作室有限公司,後場音像紀錄工作室有限公司,7,313,-59.66%,"72,220","29,923","6,575,302"
52,英國,朱門巧婦(英國國家劇院現場),2018/10/19,威秀影城股份有限公司,THE ROYAL NATIONAL THEATRE,3,72,53.19%,"45,640",329,"209,680"
53,日本,檢方的罪人,2018/10/19,車庫娛樂股份有限公司,"TOHO CO., LTD.",1,12,-55.56%,"2,750","22,660","5,153,793"
54,美國,月光光新慌慌,2018/10/19,美商美國環球影片股份有限公司台灣分公司,UNIVERSAL INTERNATIONAL FILMS LLC,2,6,-91.18%,"1,570","113,802","26,061,213"
55,美國,機器戰犬,2018/10/12,傳影互動股份有限公司,LAKESHORE ENTERTAINMENT GROUP LLC,1,39,0.00%,"3,900","8,970","1,981,245"
56,美國,一個巨星的誕生,2018/10/09,美商華納兄弟(遠東)股份有限公司台灣分公司,WARNER BROS. PICTURES INTERNATIONAL.,54,"5,313",-54.89%,"1,290,800","683,997","161,210,882"
57,法國,奧尼熊與莎琳鼠,2018/10/08,三創數位股份有限公司,弘恩文化事業有限公司,1,3,0.00%,300,7,700
58,香港,無雙,2018/10/05,台北双喜電影發行股份有限公司,(香港)博納影視娛樂有限公司##(香港)英皇影業有限公司##(大陸)上海博納文化傳媒有限公司##(大陸)上海阿里巴巴影業有限公司##(大陸)華夏電影發行有限責任公司##(大陸)博納影業集團股份有限公司##(大陸)双喜電影發行(北京)有限公司,12,"1,764",660.34%,"135,145","201,694","45,911,717"
59,南韓,鬼神拍檔,2018/10/05,車庫娛樂股份有限公司,CJ E&M CORPORATION,2,120,-31.82%,"17,760","10,841","2,408,484"
60,日本,在咖啡冷掉之前,2018/10/05,英屬維京群島商高捷全球開發有限公司 台灣分公司,"TOKYO BROADCASTING SYSTEM TELEVISION, INC.",1,10,-76.19%,"2,690","52,171","12,047,136"
61,美國,猛毒,2018/10/03,博偉電影股份有限公司,SONY PICTURES RELEASING INTERNATIONAL CORPORATION.,5,142,-79.74%,"33,205","1,189,522","277,894,358"
62,中國大陸,塑料王國,2018/09/28,視納華仁文化傳播股份有限公司,（香港）CNEX FOUNDATION LIMITED##（大陸）北京泰岳文化傳播有限責任公司（BEIJING TYC MEDIA）,1,150,-6.83%,"36,000","3,413","731,442"
63,香港,歐洲攻略,2018/09/28,華映娛樂股份有限公司,（英屬維京群島）春光映画(BLOCK 2 PICTURES INC.)##（英屬維京群島）見天地電影工作室有限公司(MASTER CHINA FILMS LTD.)##（大陸）上海銀潤傳媒廣告有限公司##（大陸）西藏恆信天地影視有限公司##（大陸）浙江天意影視有限公司##（香港）美亞電影製作有限公司,3,240,-5.88%,"29,390","8,369","1,753,967"
64,馬來西亞,李宗偉：敗者為王,2018/09/28,星泰國際娛樂股份有限公司,志博影業有限公司##馬虎電影有限公司,1,88,0.00%,"18,630","16,480","3,621,890"
65,美國,小腳怪,2018/09/28,美商華納兄弟(遠東)股份有限公司台灣分公司,WARNER BROS. PICTURES INTERNATIONAL.,1,49,-52.88%,"10,400","95,428","21,637,505"
66,中華民國,火焰中的星空,2018/09/27,符號文化股份有限公司,符號文化股份有限公司,1,323,38.03%,"71,080","1,057","232,025"
67,英國,愛麗絲夢遊仙境,2018/09/27,威秀影城股份有限公司,ROYAL OPERA HOUSE,2,68,0.00%,"47,040",198,"134,920"
68,美國,惡魔島,2018/09/21,香港商甲上娛樂有限公司台灣分公司,"RED GRANITE INTERNATIONAL,INC",6,903,71.02%,"101,545","166,045","38,877,184"
69,美國,血薄荷,2018/09/21,海樂影業股份有限公司,(匈牙利)GEM ENTERTAINMENT KFT.,7,909,278.75%,"73,370","68,891","14,982,260"
70,美國,極地之王,2018/09/21,博偉電影股份有限公司,SONY PICTURES RELEASING INTERNATIONAL CORPORATION.,6,561,-19.86%,"44,970","23,238","4,920,311"
71,香港,黃金兄弟,2018/09/21,牽猴子整合行銷股份有限公司,耀萊文娛發展有限公司##影藝人娛樂製作有限公司##(大陸)北京耀暘信盈投資有限公司##(中華民國)寬魚國際股份有限公司,5,390,348.28%,"34,010","68,418","15,652,391"
72,日本,一屍到底,2018/09/21,車庫娛樂股份有限公司,NIKKATSU CORPORATION,2,114,-66.96%,"26,920","229,500","52,891,255"
73,日本,麵包超人電影版閃耀吧！庫倫與生命之星,2018/09/21,曼迪傳播有限公司,"TMS ENTERTAINMENT CO.,LTD.",1,47,-37.33%,"10,360","4,808","1,086,979"
74,美國,失蹤網紅,2018/09/14,英屬蓋曼群島商威望國際娛樂股份有限公司台灣分公司,(英國)LIONS GATE INTERNATIONAL(UK) LIMITED,8,"1,376",71.14%,"94,255","103,153","23,602,511"
75,美國,終極戰士：掠奪者,2018/09/14,美商廿世紀福斯影片股份有限公司台灣分公司,TWENTIETH CENTURY FOX INTERNATIONAL CORPORATION.,7,672,-44.83%,"61,700","188,014","43,512,589"
76,阿根廷,密謀,2018/09/14,本萃電影有限公司,(西班牙)LATIDO CONSORCIO DE EXPORTACION DEL CINE ESPANOL SL,1,73,114.71%,"11,170","9,638","2,209,961"
77,美國,鬼修女,2018/09/06,美商華納兄弟(遠東)股份有限公司台灣分公司,WARNER BROS. PICTURES INTERNATIONAL.,5,517,-20.34%,"34,190","476,808","112,534,202"
78,美國,私刑教育2,2018/08/30,博偉電影股份有限公司,SONY PICTURES RELEASING INTERNATIONAL CORPORATION.,11,"1,752",2.16%,"145,865","304,968","69,988,145"
79,美國,瘋狂亞洲富豪,2018/08/24,美商華納兄弟(遠東)股份有限公司台灣分公司,WARNER BROS. PICTURES INTERNATIONAL.,12,"2,046",-21.03%,"186,875","283,909","66,165,656"
80,美國,我願意,2018/08/24,英屬蓋曼群島商威望國際娛樂股份有限公司台灣分公司,"STX PRODUCTIONS,LLC",1,44,41.94%,"4,400","6,335","1,073,071"
81,中華民國,鬥魚,2018/08/17,星泰國際娛樂股份有限公司,多曼尼製作有限公司##星泰國際娛樂股份有限公司##旺旺中時媒體集團##宏璟建設股份有限公司##樂到家國際娛樂股份有限公司##香港商福斯傳媒有限公司台灣分公司##(大陸)霍爾果斯鑫岳影視傳媒有限公司##(大陸)霍爾果斯觀達影視文化傳播有限公司,2,723,27.96%,"38,155","136,318","30,533,109"
82,美國,巨齒鯊,2018/08/10,美商華納兄弟（遠東）股份有限公司台灣分公司,WARNER BROS. PICTURES INTERNATIONAL.,2,255,-33.07%,"17,150","698,028","162,286,191"
83,美國,摯友維尼,2018/08/03,台灣華特迪士尼股份有限公司,"BUENA VISTA INTERNATIONAL,INC.",4,267,-28.80%,"20,145","103,141","23,482,394"
84,美國,不可能的任務：全面瓦解,2018/07/25,美商美國派拉蒙影片股份有限公司台灣分公司,PARAMOUNT PICTURES CORPORATION,7,"1,387",-36.61%,"106,790","1,895,768","447,389,870"
85,美國,尖叫旅社3:怪獸假期,2018/07/19,博偉電影股份有限公司,SONY PICTURES RELEASING INTERNATIONAL CORPORATION.,4,168,-55.08%,"18,370","310,268","68,643,410"
86,日本,名偵探柯南:零的執行人,2018/07/06,向洋影業有限公司,"TMS ENTERTAINMENT CO.,LTD.",1,40,-40.30%,"5,600","392,539","91,815,154"
87,美國,超人特攻隊2,2018/06/27,台灣華特迪士尼股份有限公司,"BUENA VISTA INTERNATIONAL,INC.",1,48,-78.48%,"1,050","1,148,316","260,565,233"
88,中華民國,愛情線索2：奇妙關係,2018/05/11,台灣牛角電影有限公司,台灣牛角電影有限公司,1,702,0.00%,"168,480","1,670","364,740"
