序號,國別地區,中文片名,上映日期,申請人,出品,上映日數,上映院數,銷售票數,周票數變動率,銷售金額,累計銷售票數,累計銷售金額
1,日本,Fate/stay night：II.迷途之蝶,2019/03/09,曼迪傳播有限公司,Aniplex Inc.,5,17,"26,822","9,023.13%","6,700,357","27,116","6,770,917"
2,泰國,限時好友,2019/03/08,威視股份有限公司,GDH 599 COMPANY LIMITED,7,60,"20,130",19.49%,"4,619,406","43,392","10,020,838"
3,香港,滾滾紅塵(數位修復版),2019/03/08,能率影業股份有限公司,湯臣(香港)電影有限公司,7,24,"5,541",1.76%,"1,209,297","10,986","2,432,066"
4,中華民國,乳‧房,2019/03/08,可樂藝術文創股份有限公司,吳美良##謝志文##廖琬玲##廖千秀,7,22,"2,042",-23.83%,"452,964","4,835","1,076,718"
5,美國,RBG：不恐龍大法官,2019/03/08,亮點國際影業有限公司,Magnolia Pictures LLC,7,12,"1,805",25.52%,"385,355","3,310","707,988"
6,美國,逆光天后,2019/03/08,傳影互動股份有限公司,FILM & TV HOUSE LIMITED,7,21,"1,169",-22.58%,"264,099","2,679","624,573"
7,德國,無主之作,2019/03/08,車庫娛樂股份有限公司,BETA CINEMA GMBH,7,15,"1,156",9.78%,"249,065","2,355","510,568"
8,法國,三小一家人,2019/03/08,海鵬影業有限公司,PATHE FILMS S.A.S.,7,13,856,-4.99%,"174,555","1,757","376,144"
9,日本,來自深淵劇場版總集篇後編：流浪之黄昏,2019/03/08,向洋影業有限公司,株式會社KADOKAWA,7,8,544,-41.44%,"128,686","1,473","352,880"
10,日本,小資女孩奮鬥記：遊樂園的奇蹟,2019/03/08,中影股份有限公司,AVEX PICTURES INC.,7,19,579,-13.45%,"118,655","1,248","262,114"
11,美國,末日孤行,2019/03/08,暗光鳥有限公司,VERTICAL ENTERTAINMENT,7,4,160,24.03%,"34,910",289,"62,795"
12,美國,驚奇隊長,2019/03/06,台灣華特迪士尼股份有限公司,"BUENA VISTA INTERNATIONAL, INC.",7,97,"482,006",-39.00%,"114,457,031","1,272,201","304,379,996"
13,南韓,密陽,2019/02/28,華聯國際影音股份有限公司,CJ E&M CORPORATION,7,3,173,-58.51%,"37,120","1,104","233,453"
14,美國,密弑遊戲,2019/02/27,博偉電影股份有限公司,SONY PICTURES RELEASING INTERNATIONAL CORPORATION.,7,75,"11,870",-47.85%,"2,717,006","90,397","20,650,117"
15,美國,酷寒殺手,2019/02/27,海樂影業股份有限公司,STUDIOCANAL,7,87,"6,411",-68.69%,"1,436,854","107,353","24,216,788"
16,美國,為副不仁,2019/02/27,車庫娛樂股份有限公司,METRO-GOLDWYN-MAYER STUDIOS INC.,7,43,"1,787",-67.50%,"406,925","26,504","5,991,541"
17,美國,法律女王,2019/02/27,英屬蓋曼群島商威望國際娛樂股份有限公司台灣分公司,"Storyteller Distribution Co., LLC pursuant to its arrangements with Participant Media, LLC",7,14,829,-62.66%,"181,889","7,079","1,613,422"
18,日本,溫泉屋小女將,2019/02/27,威秀影城股份有限公司,Nada Holdings Japan Corp.,7,10,114,-81.67%,"26,670","4,323","1,047,641"
19,香港,恭喜八婆,2019/02/27,華映娛樂股份有限公司,艾霹克影業有限公司,4,12,81,-88.14%,"17,310","3,786","810,460"
20,法國,非．虛構情事,2019/02/27,天馬行空數位有限公司,Playtime,3,2,51,-80.38%,"11,650",906,"196,078"
21,日本,吉娃娃羅曼死,2019/02/27,采昌國際多媒體股份有限公司,KADOKAWA CORPORATION,4,2,26,-84.24%,"5,895",742,"168,084"
22,日本,心的故鄉～灣生的山與海的故事,2019/02/27,春暉映像有限公司,Creative 21,3,1,4,-84.00%,810,102,"20,565"
23,加拿大,地獄自拍,2019/02/27,暗光鳥有限公司,INDUSTRYWORKS STUDIOS INC.,2,2,3,-95.45%,760,232,"51,750"
24,南韓,雞不可失,2019/02/22,英屬蓋曼群島商威望國際娛樂股份有限公司台灣分公司,CJ ENM CO. LTD,7,86,"81,711",-11.76%,"18,847,944","393,368","90,791,321"
25,日本,七龍珠‧超布羅利,2019/02/22,台北双喜電影發行股份有限公司,"東映株式會社##FOX INTERNATIONAL PRODUCTIONS, INC.",7,44,"1,888",-75.08%,"437,417","85,076","25,471,248"
26,日本,在地下城尋求邂逅是否搞錯了什麼─獵戶座之箭─,2019/02/22,天馬行空數位有限公司,Hakuhodo DY music & pictures Inc.,7,18,733,-52.86%,"175,535","21,206","5,204,719"
27,美國,梵谷：在永恆之門,2019/02/22,車庫娛樂股份有限公司,"WALK HOME PRODUCTIONS, LLC",7,6,407,-63.60%,"88,070","11,062","2,471,389"
28,加拿大,嬰魂不散,2019/02/22,海樂影業股份有限公司,SAVAGE PRODUCTION LTD,7,19,288,-82.55%,"63,755","27,180","6,256,290"
29,比利時,芭蕾少女夢,2019/02/22,鏡象電影製作有限公司,The Match Factory GmbH,4,1,53,-77.73%,"11,690","2,709","582,325"
30,日本,來自深淵劇場版總集篇前編：啟程的黎明,2019/02/22,向洋影業有限公司,株式會社KADOKAWA,4,1,22,-81.20%,"5,090","2,031","489,676"
31,南韓,證人,2019/02/21,香港商甲上娛樂有限公司台灣分公司,"LOTTE CULTUREWORKS CO., LTD.",7,41,"10,481",-32.87%,"2,404,575","55,643","12,892,242"
32,中華民國,一吻定情,2019/02/14,車庫娛樂股份有限公司,當樂娛樂股份有限公司,7,54,"3,876",-61.58%,"879,261","106,900","24,411,374"
33,美國,祝你忌日快樂,2019/02/14,美商美國環球影片股份有限公司台灣分公司,UNIVERSAL INTERNATIONAL FILMS LLC,7,32,670,-75.66%,"156,042","128,728","29,587,105"
34,美國,樂高玩電影2,2019/02/14,美商華納兄弟（遠東）股份有限公司台灣分公司,WARNER BROS. PICTURES INTERNATIONAL.,7,19,266,-80.06%,"59,700","41,196","9,506,325"
35,美國,愛‧欺,2019/02/14,威視股份有限公司,EMBANKMENT FILMS LIMITED,7,5,242,-68.45%,"51,340","18,787","4,166,950"
36,義大利,NICO，地下絲絨之後,2019/02/14,翻面映畫有限公司,Celluloid Dreams SAS,3,1,4,-87.50%,"1,240",897,"202,539"
37,美國/黎巴嫩,我想有個家,2019/02/08,海鵬影業有限公司,WILD BUNCH,7,4,246,-62.78%,"52,210","15,248","3,303,215"
38,美國,艾莉塔：戰鬥天使,2019/02/05,美商廿世紀福斯影片股份有限公司台灣分公司,TWENTIETH CENTURY FOX INTERNATIONAL CORPORATION.,7,77,"8,613",-57.30%,"2,053,651","1,089,724","274,916,164"
39,加拿大,哈柏太空之旅3D,2019/02/04,國際電影事業有限公司,IMAX Corporation,3,1,5,-89.13%,730,268,"39,475"
40,加拿大,深海獵奇3D,2019/02/03,國際電影事業有限公司,IMAX Corporation,4,1,16,-23.81%,"2,080",196,"27,365"
41,日本,日日是好日,2019/02/01,天馬行空數位有限公司,ColorBird Inc.,6,1,98,-59.67%,"20,090","9,695","2,103,315"
42,美國,愛‧滿人間,2019/02/01,台灣華特迪士尼股份有限公司,"BUENA VISTA INTERNATIONAL, INC.",4,1,24,-84.91%,"6,370","76,324","17,806,694"
43,美國,馴龍高手3,2019/01/30,美商美國環球影片股份有限公司台灣分公司,UNIVERSAL INTERNATIONAL FILMS LLC,7,57,"3,098",-59.17%,"731,029","704,049","165,473,290"
44,美國,幸福綠皮書,2019/01/25,英屬蓋曼群島商威望國際娛樂股份有限公司台灣分公司,"Storyteller Distribution Co., LLC pursuant to its arrangements with Participant Media, LLC",7,50,"10,142",-37.13%,"2,377,839","172,080","40,320,448"
45,美國,真寵,2019/01/25,美商廿世紀福斯影片股份有限公司台灣分公司,TWENTIETH CENTURY FOX INTERNATIONAL CORPORATION.,7,10,733,-56.21%,"163,379","43,276","9,873,795"
46,日本,妖怪手錶：光影之卷鬼王的復活,2019/01/25,華藝娛樂股份有限公司,Level 5 abby,1,1,12,"1,200.00%","2,640","3,091","704,215"
47,中華民國,寒單,2019/01/23,威視股份有限公司,想亮影藝股份有限公司##聚善美文創娛樂有限公司##奧瑪優勢傳媒娛樂行銷有限公司##如意休閒事業股份有限公司##彩虹塗裝有限公司##台北影業股份有限公司##北京中視星馳文化傳媒有限公司##深圳善為影業股份有限公司##廣州海盟佐佐文化傳播有限公司##東風沐電影工作室,4,2,70,-35.78%,"14,580","218,943","49,111,735"
48,日本,巧虎電影魔法島大冒險,2019/01/18,全民大劇團股份有限公司,法人倍樂生株式會社,7,15,395,-27.79%,"92,864","37,590","8,896,067"
49,日本,我的爸爸是壞蛋冠軍,2019/01/18,天馬行空數位有限公司,Hakuhodo DY music & pictures Inc.,7,2,151,122.06%,"22,520","2,016","431,283"
50,美國,魔劍少年,2019/01/18,美商廿世紀福斯影片股份有限公司台灣分公司,TWENTIETH CENTURY FOX INTERNATIONAL CORPORATION.,7,3,312,43.78%,"18,155","27,004","5,900,823"
51,美國,捍衛生死線,2019/01/11,海樂影業股份有限公司,FREEWAY ENTERTAINMENT KFT.,7,10,"1,573",59.37%,"126,335","49,914","11,125,875"
52,美國,為了與你相聚,2019/01/11,台北双喜電影發行股份有限公司,"Columbia Pictures Industries, Inc.##Bona Film Investment Company (Pacific Rim,USA)",3,8,"1,206",0.00%,"90,700","79,161","17,790,679"
53,美國,賭命運轉手,2019/01/11,美商華納兄弟（遠東）股份有限公司台灣分公司,WARNER BROS. PICTURES INTERNATIONAL.,7,8,853,116.50%,"80,125","68,259","15,574,776"
54,中國大陸,大象席地而坐,2019/01/11,繁盛映畫有限公司,赤角（北京）文化傳播有限公司,4,1,49,-51.49%,"13,210","27,961","7,051,988"
55,法國,天才樂手行不行,2019/01/11,原創娛樂股份有限公司,TF1 Studio,7,1,50,-35.90%,"7,400","3,347","697,221"
56,南韓,搖擺男孩,2019/01/11,車庫娛樂股份有限公司,CONTENTS PANDA,5,1,21,-68.18%,"3,150","22,222","5,059,694"
57,美國,私人戰爭,2019/01/04,采昌國際多媒體股份有限公司,FREEWAY ENTERTAINMENT KFT.,7,3,418,15.79%,"34,860","16,030","3,452,061"
58,瑞典,邊境奇譚,2019/01/04,傳影互動股份有限公司,FILMS BOUTIQUE SAS,7,1,66,94.12%,"10,060","10,117","2,363,910"
59,英國,盜王之王,2019/01/04,車庫娛樂股份有限公司,STUDIOCANAL SAS,7,1,87,-38.30%,"6,840","7,127","1,558,001"
60,英國,初戀手作中,2019/01/04,安可電影股份有限公司,WESTEND FILMS LTD,2,1,30,0.00%,"4,800",704,"151,800"
61,法國,近敵,2019/01/04,亮點國際影業有限公司,BAC FILMS DISTRIBUTION S.A.S.,5,1,32,-55.56%,"4,480","1,381","285,423"
62,日本,劇場版動畫借來的100天,2019/01/04,車庫娛樂股份有限公司,"TOHO CO., LTD.",4,1,17,-45.16%,"1,700",470,"97,130"
63,南韓,90分鐘末日倒數,2018/12/28,華聯國際影音股份有限公司,CJ E&M CORPORATION,7,11,"2,128",39.45%,"189,735","164,572","37,159,739"
64,美國,胡桃鉗與奇幻四國,2018/12/28,台灣華特迪士尼股份有限公司,"BUENA VISTA INTERNATIONAL,INC.",3,6,862,"10,675.00%","62,235","100,710","23,109,046"
65,香港,葉問外傳：張天志,2018/12/26,華映娛樂股份有限公司,東方影業出品有限公司##(大陸)上海天馬聯合影視文化有限公司##(大陸)上海鳴肇影視文化有限公司,7,11,"1,107",-25.65%,"95,435","147,632","32,594,879"
66,美國,班恩回家,2018/12/21,采昌國際多媒體股份有限公司,FREEWAY ENTERAINMENT KFT.,7,3,249,63.82%,"15,550","20,758","4,393,402"
67,美國,羅賓漢崛起,2018/12/20,英屬蓋曼群島商威望國際娛樂股份有限公司台灣分公司,(英國)LIONS GATE INTERNATIONAL(UK) LIMITED,7,10,"1,108",-33.05%,"85,635","171,418","38,960,403"
68,美國,蜘蛛人：新宇宙,2018/12/13,博偉電影股份有限公司,SONY PICTURES RELEASING INTERNATIONAL CORPORATION.,7,8,225,-79.01%,"55,718","191,835","44,969,411"
69,美國,水行俠,2018/12/12,美商華納兄弟（遠東）股份有限公司台灣分公司,WARNER BROS. PICTURES INTERNATIONAL.,3,1,10,-80.77%,"1,660","1,938,951","469,599,115"
70,波蘭,沒有煙硝的愛情,2018/12/08,東昊影業有限公司,MK2 Films,7,1,159,-63.19%,"35,000","9,203","2,009,043"
71,日本,POKE'MONTHEMOVIE劇場版精靈寶可夢我們的故事,2018/12/07,曼迪傳播有限公司,THE POKÉMON COMPANY,2,1,9,0.00%,"1,980","43,468","10,099,521"
72,美國,移動城市：致命引擎,2018/12/06,美商美國環球影片股份有限公司台灣分公司,UNIVERSAL INTERNATIONAL FILMS LLC,7,6,695,-54.78%,"54,625","270,617","62,248,827"
73,南韓,非賣品,2018/11/30,車庫娛樂股份有限公司,SHOWBOX CORP.,7,3,589,68.29%,"34,450","38,592","8,535,574"
74,美國,被遺忘的幸福,2018/11/30,采昌國際多媒體股份有限公司,(匈牙利)FREEWAY ENTERTAINMENT KFT.,5,1,24,-79.49%,"3,600","5,375","1,153,041"
75,美國,無敵破壞王2：網路大暴走,2018/11/29,台灣華特迪士尼股份有限公司,"BUENA VISTA INTERNATIONAL,INC.",6,3,657,682.14%,"52,800","596,445","138,326,823"
76,中華民國,人面魚紅衣小女孩外傳,2018/11/23,威視股份有限公司,中環國際娛樂事業股份有限公司##講故事有限公司##大慕影藝國際事業有限公司##華映娛樂股份有限公司##秀泰國際娛樂有限公司##國賓影城股份有限公司##樂到家國際娛樂股份有限公司##華研國際音樂股份有限公司##紅衣小女孩股份有限公司,7,6,338,-51.30%,"28,785","328,255","73,062,405"
77,中華民國,比悲傷更悲傷的故事,2018/11/18,好好看文創有限公司,滿滿額娛樂股份有限公司##好好看文創有限公司##百聿數碼創意股份有限公司##神州音樂有限公司##崴森管理顧問股份有限公司##(大陸)上海唯喜影業有限公司##(香港)福斯傳媒有限公司,7,7,"1,945",56.35%,"121,430","1,041,848","239,831,800"
78,法國,師聲對決,2018/11/16,鴻聯國際開發股份有限公司,PATHE FILMS,7,1,60,114.29%,"9,160","5,536","1,120,086"
79,美國,怪獸與葛林戴華德的罪行,2018/11/15,美商華納兄弟(遠東)股份有限公司台灣分公司,WARNER BROS. PICTURES INTERNATIONAL.,4,1,54,-92.24%,"2,700","1,060,923","254,928,807"
80,美國,大君主行動,2018/11/09,美商美國派拉蒙影片股份有限公司台灣分公司,PARAMOUNT PICTURES CORPORATION,4,1,103,1.98%,"10,330","161,937","37,228,736"
81,美國,波希米亞狂想曲,2018/11/02,美商廿世紀福斯影片股份有限公司台灣分公司,TWENTIETH CENTURY FOX INTERNATIONAL CORPORATION.,7,15,938,-50.84%,"232,348","155,467","36,631,113"
82,中華民國,狂徒,2018/10/26,貴金影業傳媒股份有限公司,貴金影業傳媒股份有限公司##高雄市電影館##喜陽影片製作有限公司,4,1,29,-79.72%,"2,280","25,916","5,692,578"
83,美國,一個巨星的誕生,2018/10/09,美商華納兄弟(遠東)股份有限公司台灣分公司,WARNER BROS. PICTURES INTERNATIONAL.,1,1,109,-71.39%,"23,435","703,613","164,420,147"
84,法國,鋼琴教師,2016/12/16,東昊影業有限公司,MK2 SOCIÉTÉ PAR ACTIONS SIMPLIFIÉE,1,1,5,0.00%,780,"2,108","439,570"
85,法國,八美圖,2002/11/16,東昊影業有限公司,Studiocanal S.A.S,7,4,338,32.55%,"71,370",593,"125,665"
